{
  "schema": "urn:aihq:report:claims:1.0.0",
  "claims": [
    {
      "id": "check-node-version",
      "revision": "1",
      "producer": {
        "id": "example-diagnostic-adapter",
        "version": "1.0.0"
      },
      "recordSchema": "urn:aihq:harness:diagnostic:1.0.0",
      "subject": {
        "kind": "tool",
        "id": "node"
      },
      "scope": {
        "kind": "machine",
        "targets": [
          "example-machine"
        ]
      },
      "sources": [
        {
          "id": "record:check-node-version",
          "schema": "urn:aihq:harness:diagnostic:1.0.0"
        }
      ],
      "observation": "event:check-node-version",
      "capturedAt": "2026-10-15T09:00:00.000Z",
      "measure": "configuration-check",
      "kind": "measured",
      "value": {
        "amount": "passed",
        "unit": "outcome"
      },
      "method": {
        "id": "example-configuration-checks",
        "version": "1.0.0"
      },
      "coverage": {
        "state": "complete",
        "reason": "every selected probe ran"
      },
      "authentication": {
        "status": "not-authenticated"
      },
      "applicability": {
        "state": "current",
        "reason": "inputs unchanged since capture",
        "inputs": [
          {
            "id": "example-policy",
            "revision": "3"
          }
        ]
      }
    },
    {
      "id": "check-npm-cafile",
      "revision": "1",
      "producer": {
        "id": "example-diagnostic-adapter",
        "version": "1.0.0"
      },
      "recordSchema": "urn:aihq:harness:diagnostic:1.0.0",
      "subject": {
        "kind": "tool",
        "id": "npm"
      },
      "scope": {
        "kind": "machine",
        "targets": [
          "example-machine"
        ]
      },
      "sources": [
        {
          "id": "record:check-npm-cafile",
          "schema": "urn:aihq:harness:diagnostic:1.0.0"
        }
      ],
      "observation": "event:check-npm-cafile",
      "capturedAt": "2026-10-15T09:00:00.000Z",
      "measure": "configuration-check",
      "kind": "measured",
      "value": {
        "amount": "passed",
        "unit": "outcome"
      },
      "method": {
        "id": "example-configuration-checks",
        "version": "1.0.0"
      },
      "coverage": {
        "state": "complete",
        "reason": "every selected probe ran"
      },
      "authentication": {
        "status": "not-authenticated"
      },
      "applicability": {
        "state": "current",
        "reason": "inputs unchanged since capture",
        "inputs": [
          {
            "id": "example-policy",
            "revision": "3"
          }
        ]
      }
    },
    {
      "id": "check-git-sslcainfo",
      "revision": "1",
      "producer": {
        "id": "example-diagnostic-adapter",
        "version": "1.0.0"
      },
      "recordSchema": "urn:aihq:harness:diagnostic:1.0.0",
      "subject": {
        "kind": "tool",
        "id": "git"
      },
      "scope": {
        "kind": "machine",
        "targets": [
          "example-machine"
        ]
      },
      "sources": [
        {
          "id": "record:check-git-sslcainfo",
          "schema": "urn:aihq:harness:diagnostic:1.0.0"
        }
      ],
      "observation": "event:check-git-sslcainfo",
      "capturedAt": "2026-10-15T09:00:00.000Z",
      "measure": "configuration-check",
      "kind": "measured",
      "value": {
        "amount": "failed",
        "unit": "outcome"
      },
      "method": {
        "id": "example-configuration-checks",
        "version": "1.0.0"
      },
      "coverage": {
        "state": "complete",
        "reason": "every selected probe ran"
      },
      "authentication": {
        "status": "not-authenticated"
      },
      "applicability": {
        "state": "current",
        "reason": "inputs unchanged since capture",
        "inputs": [
          {
            "id": "example-policy",
            "revision": "3"
          }
        ]
      }
    },
    {
      "id": "check-pip-cert",
      "revision": "1",
      "producer": {
        "id": "example-diagnostic-adapter",
        "version": "1.0.0"
      },
      "recordSchema": "urn:aihq:harness:diagnostic:1.0.0",
      "subject": {
        "kind": "tool",
        "id": "pip"
      },
      "scope": {
        "kind": "machine",
        "targets": [
          "example-machine"
        ]
      },
      "sources": [
        {
          "id": "record:check-pip-cert",
          "schema": "urn:aihq:harness:diagnostic:1.0.0"
        }
      ],
      "observation": "event:check-pip-cert",
      "capturedAt": "2026-10-15T09:00:00.000Z",
      "measure": "configuration-check",
      "kind": "unknown",
      "unknownReason": "probe deadline reached before an outcome",
      "method": {
        "id": "example-configuration-checks",
        "version": "1.0.0"
      },
      "coverage": {
        "state": "complete",
        "reason": "every selected probe ran"
      },
      "authentication": {
        "status": "not-authenticated"
      },
      "applicability": {
        "state": "current",
        "reason": "inputs unchanged since capture",
        "inputs": [
          {
            "id": "example-policy",
            "revision": "3"
          }
        ]
      }
    },
    {
      "id": "check-cargo-http",
      "revision": "1",
      "producer": {
        "id": "example-diagnostic-adapter",
        "version": "1.0.0"
      },
      "recordSchema": "urn:aihq:harness:diagnostic:1.0.0",
      "subject": {
        "kind": "tool",
        "id": "cargo"
      },
      "scope": {
        "kind": "machine",
        "targets": [
          "example-machine"
        ]
      },
      "sources": [
        {
          "id": "record:check-cargo-http",
          "schema": "urn:aihq:harness:diagnostic:1.0.0"
        }
      ],
      "observation": "event:check-cargo-http",
      "capturedAt": "2026-10-15T09:00:00.000Z",
      "measure": "configuration-check",
      "kind": "measured",
      "value": {
        "amount": "passed",
        "unit": "outcome"
      },
      "method": {
        "id": "example-configuration-checks",
        "version": "1.0.0"
      },
      "coverage": {
        "state": "complete",
        "reason": "every selected probe ran"
      },
      "authentication": {
        "status": "not-authenticated"
      },
      "applicability": {
        "state": "current",
        "reason": "inputs unchanged since capture",
        "inputs": [
          {
            "id": "example-policy",
            "revision": "3"
          }
        ]
      }
    },
    {
      "id": "check-git-sslcainfo-reimport",
      "revision": "1",
      "producer": {
        "id": "example-diagnostic-adapter",
        "version": "1.0.0"
      },
      "recordSchema": "urn:aihq:harness:diagnostic:1.0.0",
      "subject": {
        "kind": "tool",
        "id": "git"
      },
      "scope": {
        "kind": "machine",
        "targets": [
          "example-machine"
        ]
      },
      "sources": [
        {
          "id": "record:check-git-sslcainfo",
          "schema": "urn:aihq:harness:diagnostic:1.0.0"
        }
      ],
      "observation": "event:check-git-sslcainfo",
      "capturedAt": "2026-10-15T09:00:00.000Z",
      "measure": "configuration-check",
      "kind": "measured",
      "value": {
        "amount": "failed",
        "unit": "outcome"
      },
      "method": {
        "id": "example-configuration-checks",
        "version": "1.0.0"
      },
      "coverage": {
        "state": "complete",
        "reason": "every selected probe ran"
      },
      "authentication": {
        "status": "not-authenticated"
      },
      "applicability": {
        "state": "current",
        "reason": "inputs unchanged since capture",
        "inputs": [
          {
            "id": "example-policy",
            "revision": "3"
          }
        ]
      }
    },
    {
      "id": "check-java-truststore-a",
      "revision": "1",
      "producer": {
        "id": "example-diagnostic-adapter",
        "version": "1.0.0"
      },
      "recordSchema": "urn:aihq:harness:diagnostic:1.0.0",
      "subject": {
        "kind": "tool",
        "id": "java"
      },
      "scope": {
        "kind": "machine",
        "targets": [
          "example-machine"
        ]
      },
      "sources": [
        {
          "id": "record:event:java-truststore",
          "schema": "urn:aihq:harness:diagnostic:1.0.0"
        }
      ],
      "observation": "event:java-truststore",
      "capturedAt": "2026-10-15T09:00:00.000Z",
      "measure": "configuration-check",
      "kind": "measured",
      "value": {
        "amount": "passed",
        "unit": "outcome"
      },
      "method": {
        "id": "example-configuration-checks",
        "version": "1.0.0"
      },
      "coverage": {
        "state": "complete",
        "reason": "every selected probe ran"
      },
      "authentication": {
        "status": "not-authenticated"
      },
      "applicability": {
        "state": "current",
        "reason": "inputs unchanged since capture",
        "inputs": [
          {
            "id": "example-policy",
            "revision": "3"
          }
        ]
      }
    },
    {
      "id": "check-java-truststore-b",
      "revision": "1",
      "producer": {
        "id": "example-diagnostic-adapter",
        "version": "1.0.0"
      },
      "recordSchema": "urn:aihq:harness:diagnostic:1.0.0",
      "subject": {
        "kind": "tool",
        "id": "java"
      },
      "scope": {
        "kind": "machine",
        "targets": [
          "example-machine"
        ]
      },
      "sources": [
        {
          "id": "record:event:java-truststore",
          "schema": "urn:aihq:harness:diagnostic:1.0.0"
        }
      ],
      "observation": "event:java-truststore",
      "capturedAt": "2026-10-15T09:00:00.000Z",
      "measure": "configuration-check",
      "kind": "measured",
      "value": {
        "amount": "failed",